{
  "schemaVersion": 1,
  "deltaId": "pizza-delta-2026-08-09T14-52-14-57-bahrain",
  "createdAt": "2026-08-09T14:57:00+03:00",
  "sourceOfTruthRef": "docs/NORTHSTAR_SOURCE_OF_TRUTH.md#portfolio-activity-window--2026-08-09-14521457-bahrain",
  "claims": [
    {
      "claimId": "homecoming.h019a2-active",
      "projectId": "homecoming_northstar",
      "requestedState": "repairing",
      "authorityOwner": "agent",
      "riskClass": "local_safe",
      "sourceOfTruthRef": "docs/briefs/BRIEF_019A_REAL_PIZZA_UPDATE_PIPELINE.md",
      "changedSurfaces": ["portfolio_projection"],
      "evidence": [{"id": "homecoming.h019a2.report", "kind": "reported_external"}]
    },
    {
      "claimId": "hoard.brief014a-exact18-repair",
      "projectId": "hoard_northstar",
      "requestedState": "repairing",
      "authorityOwner": "agent",
      "riskClass": "local_safe",
      "sourceOfTruthRef": "Hoard Brief 014A exact contract",
      "changedSurfaces": ["portfolio_projection"],
      "evidence": [{"id": "hoard.brief014a.rejection-report", "kind": "reported_external"}]
    },
    {
      "claimId": "kingdom.k1.6-exact-root-repair",
      "projectId": "kingdom_northstar",
      "requestedState": "repairing",
      "authorityOwner": "agent",
      "riskClass": "local_safe",
      "sourceOfTruthRef": "Kingdom K1.6 defensive identity-binding repair",
      "changedSurfaces": ["portfolio_projection"],
      "evidence": [{"id": "kingdom.k1.6.repair-report", "kind": "reported_external"}]
    },
    {
      "claimId": "factory.blueprint-and-daily-scans",
      "projectId": "factory_northstar",
      "requestedState": "active",
      "authorityOwner": "agent",
      "riskClass": "local_safe",
      "sourceOfTruthRef": "Factory Blueprint and Daily Product governed lanes",
      "changedSurfaces": ["factory_nested_lane", "portfolio_projection"],
      "evidence": [{"id": "factory.activity-window.report", "kind": "reported_external"}]
    },
    {
      "claimId": "tiktok.synthetic-analytics-guardrails",
      "projectId": "tiktok_portfolio_manager",
      "requestedState": "active",
      "authorityOwner": "agent",
      "riskClass": "local_safe",
      "sourceOfTruthRef": "TikTok Portfolio Manager governed lane",
      "changedSurfaces": ["portfolio_integration_delta"],
      "evidence": [{"id": "tiktok.analytics-guardrails.report", "kind": "reported_external"}]
    }
  ]
}
